"key","en","nl","es","zh-CN","de","fr","it","pt","el","pl","da","fi","no","ar","ko","ja","iw","sv","cs","ru","tl","ceb"
"Displays the best ranked or rated products.","Displays the best ranked or rated products.","Geeft de beste gerangschikt of nominale producten.","Muestra los productos mejor clasificados o tasados.","显示最好的排名或评级的产品。","Zeigt die bestplatzierten oder bewerteten Produkte.","Affiche les produits les mieux classés ou notés.","Consente di visualizzare i prodotti più ordinati o previsti.","Exibe os produtos mais classificados ou classificados.","Εμφανίζει τις καλύτερες κατάταξη ή ονομαστική προϊόντα.","Wyświetla najlepsze miejsca, lub przystosowanych produktów.","Viser de bedst klassificeret eller normeret produkter.","Näyttää paras sijoitus tai mitoitettu tuotteita.","Viser de beste rangert eller rangerte produkter.","يعرض أفضل المنتجات المرتبة أو تصنيف.","최고의 순위 또는 등급의 제품을 표시합니다.","最高のランク付け又は定格の製品を表示します。","מציג את המוצרים הטובים ביותר מדורגים או מדורגים.","Visar de bäst rang eller specificerade produkter.","Zobrazí Nejzařazovanýjýí nebo hodnocené produkty.","Отображает лучше ранжируются или оцениваются продукты.","Ipinapakita ang mga pinakamahusay na ranggo o rate ng mga produkto.","Nagpasundayag sa mga labing maayo nga pwesto o rated nga mga produkto."
"Displays the blocks that are set to show in the home page.","Displays the blocks that are set to show in the home page.","Geeft de blokken die zijn ingesteld om te laten zien in de home page.","Muestra los bloques que se establecen para mostrar en la página principal.","显示设置在首页显示的块。","Zeigt die Blöcke, die eingestellt werden, um auf der Startseite angezeigt.","Affiche les blocs qui sont mis à afficher dans la page d'accueil.","Consente di visualizzare i blocchi che sono impostati per mostrare in home page.","Exibe os blocos que estão definidas para mostrar na página inicial.","Εμφανίζει τα μπλοκ που έχουν οριστεί για να δείξει στην αρχική σελίδα.","Wyświetla bloki, które są ustawione, aby pokazać się na stronie głównej.","Viser de blokke, der er indstillet til at vise i hjemmesiden.","Näyttää lohkot asetetaan näkyä etusivulle.","Viser blokkene som er satt til å vise på hjemmesiden.","يعرض القطع التي تم تعيينها لتظهر في الصفحة الرئيسية.","홈 페이지에 표시하도록 설정되어 블록을 표시합니다.","ホームページに表示するように設定されているブロックを表示します。","מציג את הלוקים שמוגדרים להצגה בדף הבית.","Visar block som är inställda på att visa på hemsidan.","Zobrazuje bloky, které jsou nastaveny pro zobrazení na domovské stránce.","Отображение блоков, которые установлены, чтобы показать на домашней странице.","Ipinapakita ang mga bloke na ay nakatakda upang ipakita sa home page.","Nagpasundayag sa mga bloke nga gibutang sa pagpakita sa home page."
"Displays the chapter about the difference between listed pages here.","Displays the chapter about the difference between listed pages here.","Geeft het hoofdstuk over het verschil tussen de genoemde pagina hier.","Muestra el capítulo acerca de la diferencia entre las páginas enumeradas aquí.","显示关于此处列出页之间的差的一章。","Zeigt die Kapitel über den Unterschied zwischen aufgeführten Seiten hier.","Affiche le chapitre sur la différence entre les pages sont répertoriées ici.","Visualizza il capitolo sulla differenza tra pagine elencate qui.","Apresenta o capítulo sobre a diferença entre as páginas listadas aqui.","Εμφανίζει το κεφάλαιο σχετικά με τη διαφορά μεταξύ εισηγμένων σελίδες εδώ.","Wyświetla rozdział o różnicy pomiędzy wymienionych stron tutaj.","Viser kapitlet om forskellen mellem børsnoterede sider her.","Näyttää lukua ero on lueteltu sivuilla täällä.","Viser kapittel om forskjellen mellom børsnoterte sider her.","يعرض الفصل عن الفرق بين الصفحات المذكورة هنا.","여기에 나열된 페이지 사이의 차이에 대한 장을 표시합니다.","ここに記載されているページの違いについての章を表示します。","מציג את הפרק על ההבדל בין דפים הרשומים כאן.","Visar kapitlet om skillnaden mellan börsnoterade sidor här.","Zobrazuje kapitola o rozdílu mezi uvedenými stránkách zde.","Отображает главу о разнице между перечисленных страниц здесь.","Ipinapakita ang mga kabanata tungkol sa mga pagkakaiba sa pagitan ng mga pahina na nakalista dito.","Nagpasundayag sa sa kapitulo mahitungod sa mga kalainan tali sa gilista mga panid dinhi."
"Displays the chapter about the rest-API.","Displays the chapter about the rest-API.","Geeft het hoofdstuk over de rest-API.","Muestra el capítulo sobre el resto-API.","显示有关的REST API的章节。","Zeigt die Kapitel über den Rest-API.","Affiche le chapitre sur le reste-API.","Visualizza il capitolo sul resto-API.","Apresenta o capítulo sobre o resto-API.","Εμφανίζει το κεφάλαιο για την υπόλοιπη-API.","Wyświetla rozdział o reszcie-API.","Viser kapitlet om resten-API.","Näyttää lukua loput-API.","Viser kapittel om resten-API.","يعرض الفصل حول-API بقية.","나머지-API에 대한 장을 표시합니다.","残り-APIに関する章を表示します。","מציג את הפרק על שאר-API.","Visar kapitlet om resten-API.","Zobrazuje kapitola o klidové-API.","Отображает главу о покоя API.","Ipinapakita ang mga kabanata tungkol sa natitirang-API.","Nagpasundayag sa sa kapitulo mahitungod sa uban-API."
"Displays the chapter about the templatnig system in general.","Displays the chapter about the templatnig system in general.","Geeft het hoofdstuk over het templatnig systeem in het algemeen.","Muestra el capítulo sobre el sistema templatnig en general.","显示有关templatnig系统一般的章节。","Zeigt die Kapitel über die templatnig System im Allgemeinen.","Affiche le chapitre sur le système de templatnig en général.","Visualizza il capitolo sul sistema templatnig in generale.","Apresenta o capítulo sobre o sistema templatnig em geral.","Εμφανίζει το κεφάλαιο για το σύστημα templatnig γενικότερα.","Wyświetla rozdział o systemie templatnig w ogóle.","Viser kapitlet om templatnig system i almindelighed.","Näyttää lukua templatnig järjestelmä yleensä.","Viser kapittelet om templatnig systemet generelt.","يعرض الفصل حول نظام templatnig بشكل عام.","일반적으로 templatnig 시스템에 대한 장을 표시합니다.","一般的にtemplatnigシステムに関する章を表示します。","מציג את הפרק על מערכת templatnig באופן כללי.","Visar kapitlet om templatnig systemet i allmänhet.","Zobrazuje kapitola o templatnig systému obecně.","Отображает главу о системе templatnig в целом.","Ipinapakita ang mga kabanata tungkol sa templatnig sistema sa pangkalahatan.","Nagpasundayag sa sa kapitulo mahitungod sa templatnig sistema sa kinatibuk-."
"Displays the checkout form of the customer.","Displays the checkout form of the customer.","Geeft de kassa vorm van de klant.","Muestra la forma de pago del cliente.","显示客户的结算形式。","Zeigt die Kasse Form des Kunden.","Affiche le formulaire de commande du client.","Visualizza il modulo di checkout del cliente.","Exibe o formulário de checkout do cliente.","Εμφανίζει τη μορφή ταμείο του πελάτη.","Wyświetla formularz kasy klienta.","Viser kassen form af kunden.","Näyttää kassalle muodossa asiakkaalle.","Viser kassa form av kunden.","يعرض شكل الخروج من العملاء.","고객의 체크 아웃 양식을 표시합니다.","お客様のチェックアウトフォームを表示します。","מציג את טופס הלקוחות של הלקוח.","Visar kassan form av kunden.","Zobrazuje pokladní formu zákazníka.","Отображает кассе форму заказчика.","Ipinapakita ang checkout form ng customer.","Pagpakita sa pagpagawas sa dagway sa mga customer."
"Displays the copy right details of the Shop Shop Shop.","Displays the copy right details of the Shop Shop Shop.","Geeft de kopie juiste details van de Winkel Winkel Winkel.","Muestra los detalles de copia derecho de la Tiendas Tiendas Tiendas.","显示网店铺店的副本右侧的详细信息。","Zeigt die Kopie rechts Details der Handel Handel Handel.","Affiche la copie de détails droite de la Boutique Shop.","Visualizza i giusti copia Dati del negozio Shop.","Exibe os detalhes de cópia direita da Loja Loja Loja.","Εμφανίζει τα σωστά στοιχεία αντίγραφο του Καταστήματα Καταστήματα Καταστήματα.","Wyświetla kopiowania odpowiednie szczegóły Shop Shop Shop.","Viser kopi rigtige detaljer i Butik Køb Shop.","Näyttää kopio oikealla yksityiskohdat Kauppa Kauppa Kauppa.","Viser kopierings riktige detaljene i Butikk Butikk Butikk.","يعرض اليمنى تفاصيل النسخة لمتجر متجر متجر.","가게 가게 가게의 사본 권리 세부 사항을 표시합니다.","ショップショップショップのコピー右の詳細を表示します。","מציג את הפרטים הנכונים העותק של החנות חנות החנות.","Visar kopierings rätt uppgifter om Shop Shop.","Zobrazuje kopírování správné údaje o Prodejny Prodejny Prodejny.","Отображает копирования нужных деталей магазин Магазин.","Ipinapakita ang mga copy right detalye ng Shop Shop Shop.","Nagpasundayag sa sa kopya tuo nga detalye sa Shop Shop Shop."
"Displays the description of the replacer.","Displays the description of the replacer.","Geeft de omschrijving van de vervanger.","Muestra la descripción del sustituto.","显示替代的描述。","Zeigt die Beschreibung des Ersatzstoff.","Affiche la description du substitut.","Visualizza la descrizione del sostituto.","Mostra a descrição do substituto.","Εμφανίζει την περιγραφή του υποκατάστατου.","Wyświetla opis zamiennika.","Viser beskrivelsen af ​​mælkeerstatning.","Näyttää kuvauksen korvike.","Viser beskrivelsen av erstatteren.","يعرض وصف بديل.","대체물의 설명을 표시합니다.","代替品の説明が表示されます。","מציג את התיאור של תחליף.","Visar beskrivningen av ersättare.","Zobrazuje popis náhražka.","Отображает описание заменитель.","Ipinapakita ang mga paglalarawan ng mga replacer.","Pagpakita sa paghulagway sa replacer."
"Displays the details and mutations of the order.","Displays the details and mutations of the order.","Geeft de details en de mutaties van de bestelling.","Muestra los detalles y las mutaciones de la orden.","显示订单的详细信息和突变。","Zeigt die Details und Mutationen der Bestellung.","Affiche les détails et les mutations de l'ordre.","Consente di visualizzare i dettagli e le mutazioni dell'ordine.","Exibe os detalhes e mutações da ordem.","Εμφανίζει τις λεπτομέρειες και τις μεταλλάξεις της παραγγελίας.","Wyświetla szczegóły i mutacje kolejności.","Viser detaljer og mutationer af ordren.","Näyttää yksityiskohdista ja mutaatiot tilauksen.","Viser detaljene og mutasjoner av bestillingen.","يعرض تفاصيل وتحولات من هذا الأمر.","주문의 세부 사항과 돌연변이를 표시합니다.","注文の詳細と変異を表示します。","מציג את הפרטים ומוטציות של הצו.","Visar detaljer och mutationer i ordning.","Zobrazí detaily a mutace v řádu.","Отображает подробную информацию и мутации порядка.","Ipinapakita ang mga detalye at mga mutations ng order.","Pagpakita sa mga detalye ug mga mutasyon sa kapunongan."
"Displays the details of the invoice.","Displays the details of the invoice.","Geeft de details van de factuur.","Muestra los detalles de la factura.","显示发票的细节。","Zeigt die Details der Rechnung.","Affiche les détails de la facture.","Consente di visualizzare i dettagli della fattura.","Exibe os detalhes da fatura.","Εμφανίζει τα στοιχεία του τιμολογίου.","Wyświetla szczegółowe informacje na fakturze.","Viser detaljerne i fakturaen.","Näyttää yksityiskohdista laskun.","Viser detaljene i fakturaen.","يعرض تفاصيل الفاتورة.","송장의 세부 사항을 표시합니다.","請求書の詳細を表示します。","הצגת הפרטים של החשבונית.","Visar information om fakturan.","Zobrazí podrobnosti o faktury.","Отображает подробную информацию о счете-фактуре.","Ipinapakita ang mga detalye ng invoice.","Pagpakita sa mga detalye sa mga resibo."
"Displays the details of the shipping.","Displays the details of the shipping.","Geeft de details van de scheepvaart.","Muestra los detalles del envío.","显示航运的细节。","Zeigt die Details der Versandkosten.","Affiche les détails de l'expédition.","Consente di visualizzare i dettagli della spedizione.","Exibe os detalhes do envio.","Εμφανίζει τις λεπτομέρειες της αποστολής.","Wyświetla szczegółowe informacje o wysyłce.","Viser detaljerne i shipping.","Näyttää yksityiskohdista merenkulun.","Viser detaljene i shipping.","يعرض تفاصيل الشحن.","배송의 세부 사항을 표시합니다.","出荷の詳細を表示します。","הצגת הפרטים של המשלוח.","Visar information om sjöfarten.","Zobrazí podrobnosti o lodní dopravy.","Отображает подробную информацию о доставки.","Ipinapakita ang mga detalye ng pagpapadala.","Pagpakita sa mga detalye sa mga shipping."
"Displays the error page for an unknown command.","Displays the error page for an unknown command.","Geeft de fout pagina voor een onbekend commando.","Muestra la página de error para un comando desconocido.","显示未知命令错误页面。","Zeigt die Fehlerseite für ein unbekanntes Kommando.","Affiche la page d'erreur pour une commande inconnue.","Visualizza la pagina di errore per un comando sconosciuto.","Exibe a página de erro para um comando desconhecido.","Εμφανίζει τη σελίδα σφαλμάτων για μια άγνωστη εντολή.","Wyświetla stronę błędu dla nieznanego polecenia.","Viser fejlen side for en ukendt kommando.","Näyttää virhesivu tuntemattoman komennon.","Viser feil side for en ukjent kommando.","يعرض صفحة الخطأ لأمر معروف.","알 수없는 명령에 대한 오류 페이지를 표시합니다.","不明なコマンドのエラーページを表示します。","מציג את דף השגיאה לפקודה לא ידועה.","Visar felsidan för en okänd kommando.","Zobrazí chybová stránka pro neznámou příkaz.","Отображение страницы ошибок для неизвестного команды.","Ipinapakita ang mga pahina ng error para sa isang hindi kilalang command.","Nagpasundayag sa mga sayop nga pahina alang sa usa ka wala mailhi nga sugo."
"Displays the faq questions.","Displays the faq questions.","Geeft de faq vragen.","Muestra las preguntas preguntas frecuentes.","显示常见问题解答问题。","Zeigt die FAQ Fragen.","Affiche les questions faq.","Consente di visualizzare le domande faq.","Exibe as Perguntas Freqüentes.","Εμφανίζει τις ερωτήσεις Συχνές ερωτήσεις.","Wyświetla pytania FAQ.","Viser faq spørgsmål.","Näyttää faq kysymyksiin.","Viser SPØRSMÅL.","يعرض الأسئلة التعليمات.","자주 묻는 질문 질문을 표시합니다.","よくある質問質問を表示します。","מציג את השאלות הנפוצות.","Visar faq frågor.","Zobrazí faq otázky.","Отображает справку вопросы.","Ipinapakita ang mga katanungan faq.","Nagpasundayag sa sa FAQ pangutana."
"Displays the frequently asked questions.","Displays the frequently asked questions.","Geeft de meest gestelde vragen.","Muestra las preguntas más frecuentes.","显示常见问题。","Zeigt die am häufigsten gestellten Fragen.","Affiche les questions fréquemment posées.","Consente di visualizzare le domande frequenti.","Exibe as perguntas mais frequentes.","Εμφανίζει τις συχνές ερωτήσεις.","Wyświetla najczęściej zadawane pytania.","Viser de ofte stillede spørgsmål.","Näyttää usein kysyttyjä kysymyksiä.","Viser de vanligste spørsmålene.","يعرض الأسئلة المتداولة.","자주 제기되는 질문 사항을 표시합니다.","よく寄せられる質問を表示します。","מציג את השאלות הנפוצות.","Visar vanliga frågor.","Zobrazí často kladené otázky.","Отображает часто задаваемые вопросы.","Ipinapakita ang mga madalas na tinatanong na mga katanungan.","Nagpasundayag sa mga komon nga mga pangutana."
"Displays the General Information of the IncraShop Manual. ","Displays the General Information of the IncraShop Manual. ","Geeft de algemene informatie van de IncraShop Manual.","Muestra la información general del Manual IncraShop.","显示IncraShop手册的基本信息。","Zeigt die Informationen des IncraShop Manual.","Affiche l'information générale du Manuel IncraShop.","Consente di visualizzare le informazioni generali del Manuale IncraShop.","Exibe informações gerais do Manual IncraShop.","Εμφανίζει την γενική ενημέρωση του εγχειριδίου IncraShop.","Wyświetla informacje ogólne Podręcznika IncraShop.","Viser Generelle oplysninger for IncraShop Manual.","Näyttää yleistietoa IncraShop käsikirjan.","Viser Generell informasjon av IncraShop Manual.","يعرض معلومات عامة من دليل IncraShop.","IncraShop 매뉴얼의 일반 정보를 표시합니다.","IncraShopマニュアルの一般的な情報が表示されます。","מציג את המידע הכללי של ידני IncraShop.","Visar allmän information om IncraShop Manual.","Zobrazí Obecné informace o IncraShop manuálu.","Отображает Дополнительная информация Руководства IncraShop.","Ipinapakita ang mga Pangkalahatang Impormasyon ng IncraShop Manual.","Pagpakita sa Kinatibuk-ang Information sa IncraShop Manual."
"Displays the list of invoices of the customer.","Displays the list of invoices of the customer.","Toont de lijst van de facturen van de klant.","Muestra la lista de las facturas de los clientes.","显示的客户的发票清单。","Zeigt die Liste der Rechnungen des Kunden.","Affiche la liste des factures du client.","Visualizza l'elenco delle fatture del cliente.","Exibe a lista de faturas do cliente.","Εμφανίζει τη λίστα των τιμολογίων του πελάτη.","Wyświetla listę faktur klienta.","Viser listen over fakturaer hos kunden.","Näyttää luettelon laskuista asiakkaan.","Viser listen over fakturaer til kunden.","يعرض قائمة الفواتير من العملاء.","고객의 송장의 목록을 표시합니다.","お客様の請求書のリストを表示します。","מציג את רשימת החשבוניות של הלקוח.","Visar listan över fakturor kunden.","Zobrazí seznam faktur zákazníka.","Отображает список счетов клиента.","Ipinapakita ang listahan ng mga invoice sa mga customer.","Pagpakita sa listahan sa mga invoices sa mga customer."
"Displays the list of orders made by the customer.","Displays the list of orders made by the customer.","Toont de lijst van de orders die door de klant.","Muestra la lista de pedidos realizados por el cliente.","显示由客户作出的命令的列表。","Zeigt die Liste der Bestellungen durch den Kunden.","Affiche la liste des commandes passées par le client.","Visualizza l'elenco degli ordini effettuati dal cliente.","Exibe a lista de pedidos feitos pelo cliente.","Εμφανίζει τη λίστα των εντολών γίνεται από τον πελάτη.","Wyświetla listę zamówień złożonych przez klienta.","Viser listen af ​​ordrer fra kunden.","Näyttää luettelo tilauksista asiakkaan tekemät.","Viser listen over bestillinger gjort av kunden.","يعرض قائمة من الطلبات التي تم إجراؤها من قبل الزبون.","고객에 의한 명령의 목록을 표시합니다.","顧客によって行われた注文のリストが表示されます。","מציג את רשימת ההזמנות שנעשו על ידי הלקוח.","Visar listan över beställningar som gjorts av kunden.","Zobrazí seznam objednávek zákazníkem.","Отображает список заказов, сделанных клиентом.","Ipinapakita ang listahan ng mga order na ginawa ng customer.","Pagpakita sa listahan sa mga sugo nga gihimo sa mga customer."
"Displays the list of product reviews added by the customer.","Displays the list of product reviews added by the customer.","Toont de lijst van product beoordelingen toegevoegd door de klant.","Muestra la lista de comentario añadido por el cliente.","显示由客户添加的商品评论列表。","Zeigt die Liste der Bewertungen ergänzt durch den Kunden.","Affiche la liste des avis sur les produits ajoutés par le client.","Visualizza l'elenco di recensioni di prodotti aggiunti dal cliente.","Exibe a lista de produtos avaliados adicionados pelo cliente.","Εμφανίζει τη λίστα των προϊόντων που προστίθενται κριτικές από τον πελάτη.","Wyświetla listę recenzje produktów dodanych przez klienta.","Viser listen over anmeldelser tilføjet af kunden.","Näyttää luettelon tuotearvioita lisännyt asiakkaan.","Viser listen over produktomtaler lagt av kunden.","يعرض قائمة من المنتجات الاستعراضات وأضاف من قبل الزبون.","고객이 추가 제품 리뷰의 목록을 표시합니다.","顧客が追加された商品のレビュー一覧を表示します。","מציג את רשימת ביקורות המוצר הוסיפו על ידי הלקוח.","Visar listan över recensioner som lagts till av kunden.","Zobrazí seznam hodnocení výrobků přidaných zákazníkem.","Отображает список обзоров продукции добавленных пользователем.","Ipinapakita ang listahan ng mga review ng produkto idinagdag sa pamamagitan ng mga customer.","Pagpakita sa listahan sa mga produkto reviews dugang sa mga customer."
"Displays the list of products included in the featured products","Displays the list of products included in the featured products","Toont de lijst van producten in de schijnwerpers","Muestra la lista de productos incluidos en los productos destacados","显示列入重点产品产品列表","Zeigt die Liste der Produkte in den vorgestellten Produkten enthalten","Affiche la liste des produits inclus dans les produits en vedette","Visualizza l'elenco dei prodotti inclusi nei prodotti in vetrina","Exibe a lista de produtos incluídos nos produtos em destaque","Εμφανίζει τον κατάλογο των προϊόντων που περιλαμβάνονται στα προτεινόμενα προϊόντα","Wyświetla listę produktów objętych polecanych produktów","Viser listen over produkter, der indgår i de udvalgte produkter","Näyttää luettelon kuuluvien tuotteiden Valikoidut tuotteet","Viser listen over produktene som inngår i de utvalgte produkter","يعرض قائمة من المنتجات المدرجة في منتجات مميزة","제품의리스트에 포함 된 추천 상품 표시","おすすめ商品に含まれる製品のリストを表示します","מציג את רשימת המוצרים שנכללה במוצרים מומלצים","Visar listan över produkter som ingår i de presenterade produkter","Zobrazí se seznam produktů zahrnutých do Speciální nabídka","Отображает список продуктов, включенных в рекомендуемых товаров","Ipinapakita ang listahan ng mga produkto na kasama sa tampok na mga produkto","Pagpakita sa listahan sa mga produkto nga naglakip sa sa mga produkto Featured"
