"key","en","nl","es","zh-CN","de","fr","it","pt","el","pl","da","fi","no","ar","ko","ja","iw","sv","cs","ru","tl","ceb"
"Provides a form where a customer can enter a new address.","Provides a form where a customer can enter a new address.","Biedt een vorm waarbij een klant een nieuw adres kunt invoeren.","Proporciona una forma donde un cliente puede entrar en una nueva dirección.","提供一个顾客可以输入新的地址的形式。","Bietet ein Formular, in dem ein Kunde eine neue Adresse eingeben.","Fournit une forme où un client peut entrer une nouvelle adresse.","Fornisce un modulo in cui un cliente può inserire un nuovo indirizzo.","Fornece um formulário onde um cliente pode digitar um novo endereço.","Παρέχει μια φόρμα όπου ο πελάτης μπορεί να εισέλθει σε μια νέα διεύθυνση.","Zapewnia formularz, w którym klient może wprowadzić nowy adres.","Giver en form, hvor en kunde kan indtaste en ny adresse.","Tarjoaa muoto, jossa asiakas voi tulla uusi osoite.","Gir et skjema der en kunde kan legge inn en ny adresse.","يوفر النموذج حيث يمكن للعميل إدخال عنوان جديد.","고객이 새 주소를 입력 할 수있는 양식을 제공합니다.","顧客は新しい住所を入力できるフォームを提供します。","מספק טופס שבו הלקוח יכול להזין כתובת חדשה.","Ger ett formulär där en kund kan ange en ny adress.","Poskytuje formulář, kde může zákazník zadat novou adresu.","Обеспечивает форму, где клиент может ввести новый адрес.","Magdudulot ng isang form na kung saan ang isang customer ay maaaring magpasok ng isang bagong address.","Naghatag og usa ka porma diin ang usa ka customer sa usa ka bag-o nga makasulod address."
"Provides a form where you can enter the details to create an account","Provides a form where you can enter the details to create an account","Biedt een formulier waar u de gegevens kunt invoeren om een ​​account aan te maken","Proporciona una forma en la que puede introducir los detalles para crear una cuenta","提供了在那里你可以输入详细的表单创建一个帐户","Stellt ein Formular, in dem Sie die Daten eingeben können, um ein Konto zu erstellen","Fournit un formulaire où vous pouvez entrer les détails pour créer un compte","Fornisce un modulo in cui è possibile inserire i dati per creare un account","Fornece um formulário onde você pode digitar os detalhes para criar uma conta","Παρέχει μια φόρμα όπου μπορείτε να εισαγάγετε τα στοιχεία για να δημιουργήσετε ένα λογαριασμό","Znajduje się formularz, w którym można wprowadzić dane, aby utworzyć konto","Giver en formular, hvor du kan indtaste oplysningerne til at oprette en konto","Tarjoaa lomake jossa voit kirjoittaa tiedot luoda tilin","Gir et skjema der du kan skrive inn detaljene for å opprette en konto","توفر استمارة حيث يمكنك ادخال التفاصيل لإنشاء حساب","당신이 세부 사항을 입력 할 수있는 형태 계정을 만들려면 제공","アカウントを作成するために、詳細を入力できるフォームを提供します","מספק טופס שבו אתה יכול להיכנס לפרטים כדי ליצור חשבון","Ger ett formulär där du kan ange information för att skapa ett konto","Poskytuje formulář, kde můžete zadat údaje k vytvoření účtu","Обеспечивает форма, где вы можете ввести данные для создания учетной записи","Nagbibigay ng isang form kung saan maaari mong ipasok ang mga detalye upang lumikha ng isang account","Naghatag og usa ka porma diin kamo makasulod sa mga detalye sa paghimo sa usa ka asoy"
"Provides the login form and create an account button","Provides the login form and create an account button","Biedt het login formulier en maak een account knop","Proporciona la forma de inicio de sesión y crear un botón de la cuenta","提供的登录表单，并创建一个帐户按钮","Stellt das Anmeldeformular und ein Konto erstellen Taste","Fournit le formulaire de connexion et de créer un bouton de compte","Fornisce il form di login e creare un pulsante di conto","Fornece o formulário de login e criar um botão de conta","Παρέχει τη φόρμα σύνδεσης και να δημιουργήσετε ένα κουμπί λογαριασμού","Zapewnia formularz logowania i utworzyć przycisk konta","Giver login-formularen og opret en konto knap","Tarjoaa sisäänkirjautumislomake ja luo tili -painiketta","Gir innloggingsskjemaet og opprette en konto knappen","يقدم نموذج تسجيل الدخول وإنشاء زر حساب","로그인 양식을 제공하고 계정 생성 버튼을","ログインフォームを提供し、アカウントボタンを作成","מספק טופס ההתחברות וליצור כפתור חשבון","Ger inloggningsformuläret och skapa ett konto på knappen","Poskytuje přihlašovací formulář a vytvořit tlačítko účet","Обеспечивает регистрационную форму и создать кнопку счета","Nagbibigay ang login form at lumikha ng isang pindutan ng account","Mohatag sa login porma ug sa paghimo sa usa ka asoy button"
"Provides the login form and 'create an account' button","Provides the login form and ‘create an account’ button","Biedt het login formulier en 'een account aanmaken' knop","Proporciona el botón de formulario de acceso y crear una cuenta","提供的登录表单和“创建帐户”按钮","Stellt das Anmeldeformular und ein Konto erstellen 'Button","Fournit le bouton de formulaire de connexion et «créer un compte»","Fornisce il pulsante il form di login e 'creare un account'","Fornece o formulário de login e criar uma conta botão","Παρέχει κουμπί η φόρμα login και «δημιουργήστε ένα λογαριασμό","Zapewnia przycisk formularza logowania i utworzyć konto","Giver login-formularen og oprette en konto 'knappen","Tarjoaa sisäänkirjautumislomake ja luo tili -painiketta","Gir innloggingsskjemaet og opprette en konto -knappen","يقدم نموذج تسجيل الدخول و إنشاء حساب زر","로그인 폼과 '계정 만들기'버튼을 제공합니다","ログインフォームと「アカウントを作成」ボタンを提供します","מספק כפתור בטופס ההתחברות ו'ליצור חשבון '","Ger inloggningsformuläret och skapa ett konto -knappen","Poskytuje přihlašovací formulář a vytvořit účet tlačítko","Обеспечивает кнопку формы Войти и «зарегистрироваться»","Nagbibigay ang login form at 'lumikha ng isang account' button","Mohatag sa login porma ug 'paghimo sa usa ka asoy' button"
"Provides the login form and 'create an account' button.","Provides the login form and ‘create an account’ button.","Biedt het login formulier en de knop 'een account aanmaken'.","Proporciona la forma de inicio de sesión y el botón crear una cuenta.","提供的登录表单和“创建帐户”按钮。","Stellt das Anmeldeformular und Benutzerkonto erstellen klicken.","Fournit le formulaire de connexion et le bouton «créer un compte».","Fornisce il form di login e il pulsante 'creare un account'.","Fornece o formulário de login e botão criar uma conta.","Παρέχει τη φόρμα σύνδεσης και το κουμπί «δημιουργήστε ένα λογαριασμό.","Zapewnia formularz logowania i przycisk Utwórz konto.","Giver login-formularen og oprette en konto 'knappen.","Tarjoaa sisäänkirjautumislomake ja luo tili -painiketta.","Gir innloggingsskjemaet og opprette en konto -knappen.","يقدم نموذج تسجيل الدخول وزر إنشاء حساب.","로그인 폼과 '계정 만들기'버튼을 제공합니다.","ログインフォームと「アカウントを作成」ボタンを提供します。","מספק טופס ההתחברות וכפתור 'צור חשבון'.","Ger inloggningsformuläret och skapa ett konto -knappen.","Poskytuje přihlašovací formulář a tlačítkem 'Vytvořit účet'.","Обеспечивает регистрационную форму и кнопку Создать учетную запись.","Nagbibigay ang login form at pindutan na 'lumikha ng isang account'.","Mohatag sa login porma ug 'paghimo sa usa ka asoy' button."
"Redisplayes the single comment again after updating the status in a block for ajax usage.","Redisplayes the single comment again after updating the status in a block for ajax usage.","Redisplayes de enige reactie weer na het updaten van de status in een blok voor ajax gebruik.","Redisplayes el solo comentario nuevo después de actualizar el estado en un bloque para el uso de ajax.","在更新了AJAX的使用块的状态后再次Redisplayes单一的评论。","Redisplayes den einzelnen Kommentar wieder nach der Aktualisierung der Statusleiste für Ajax-Nutzung.","Redisplayes nouveau le seul commentaire après la mise à jour de l'état dans un bloc pour l'utilisation de l'Ajax.","Redisplayes di nuovo il singolo commento dopo l'aggiornamento dello stato in un blocco per l'utilizzo ajax.","Redisplayes o único comentário novamente depois de atualizar o status em um bloco para uso de ajax.","Redisplayes το μόνο σχόλιο και πάλι μετά την ενημέρωση της κατάστασης σε ένα μπλοκ για χρήση ajax.","Redisplayes pojedynczy komentarz ponownie po aktualizacji statusów bloku do użytku ajax.","Redisplayes enkelt bemærkning igen efter opdatering af status i en blok til brug ajax.","Redisplayes yhden kommentin uudelleen päivityksen jälkeen asema lohkossa Ajax käyttö.","Redisplayes singelen kommentar igjen etter oppdatering av status i en blokk for ajax bruk.","Redisplayes تعليق واحد مرة أخرى بعد تحديث حالة في كتلة للاستخدام اياكس.","아약스 사용에 대한 블록의 상태를 업데이트 한 후 다시 하나의 코멘트를 Redisplayes.","Ajaxの使用のためのブロックでステータスを更新した後、再び単一のコメントをRedisplayes。","Redisplayes התגובה אחת שוב לאחר עדכון הסטטוס בבלוק לשימוש AJAX.","Redisplayes den enda kommentaren igen efter uppdatering av status i ett block för ajax användning.","Redisplayes jediný komentář znovu po aktualizaci stavu v bloku pro použití Ajax.","Redisplayes единого комментарий снова после обновления статуса в блоке для использования AJAX.","Redisplayes muli ang nag-iisang komento pagkatapos ng pag-update ng katayuan sa isang bloke para sa paggamit ajax.","Redisplayes ang single komento pag-usab human sa update sa status sa usa ka block sa Ajax paggamit."
"Show current information and internal status","Show current information and internal status","Toon actuele informatie en interne status","Mostrar información actual y el estado interno","显示当前信息和内部状态","Zeigen Sie aktuelle Informationen und internen Status","Afficher des informations actuelles et statut interne","Visualizza informazioni attuali e stato interno","Mostrar informações atuais e estatuto interno","Δείτε τις τρέχουσες πληροφορίες και την εσωτερική κατάσταση","Pokaż aktualne informacje i stan wewnętrzny","Vis aktuelle oplysninger og interne status","Näytä ajankohtaista tietoa ja asemasta","Vis aktuell informasjon og intern status","مزيد من المعلومات الحالية والوضع الداخلي","현재 정보 및 내부 상태를 표시","現在の情報と内部状態を表示します","הצג מידע הנוכחי ומצב פנימי","Visa aktuell information och interna status","Ukázat aktuální informace a vnitřní stav","Показать текущую информацию и внутреннее состояние","Ipakita ang mga kasalukuyang impormasyon at panloob na katayuan","Ipakita kasamtangan nga impormasyon ug internal nga kahimtang"
"Templates: Templates available","Templates: Templates available","Templates: sjablonen beschikbaar","Plantillas: Plantillas disponibles","模板：模板可用","Vorlagen: Vorlagen zur Verfügung","Modèles: Modèles disponibles","Modelli: modelli disponibili","Modelos: Modelos disponíveis","Πρότυπα: διαθέσιμο Πρότυπα","Szablony: Szablony dostępne","Skabeloner: skabeloner til rådighed","Mallit: Mallit saatavilla","Maler: Maler tilgjengelig","القوالب: القوالب المتوفرة","템플릿 : 템플릿 수","テンプレート：使用可能なテンプレート","תבניות: תבניות זמינות","Mallar: Mallar tillgängliga","Šablony: Šablony k dispozici","Шаблоны: Шаблоны доступны","Template: magagamit Template","Templates: Templates anaa"
"Template 'name': Information on the specific template","Template 'name': Information on the specific template","Template 'naam': Informatie over de specifieke template","Nombre Plantilla: Información sobre la plantilla específica","模板“名称”：在特定的模板信息","Template 'name': Informationen zur bestimmten Vorlage","Modèle 'nom': Information sur le modèle spécifique","Template 'name': Informazioni sul modello specifico","Template 'nome': Informações sobre o modelo específico","Πρότυπο «όνομα»: Πληροφορίες σχετικά με το συγκεκριμένο πρότυπο","Template 'name': Informacje na temat konkretnego szablonu","Skabelon 'navn': Oplysninger om bestemt skabelon","Template nimi: Tiedot tietty malli","Mal 'navn': Informasjon om bestemt mal","قالب 'اسم': معلومات عن قالب محدد","템플릿 '이름'특정 템플릿에 대한 정보","テンプレート「名前」：特定のテンプレートの情報","שם' התבנית: מידע על התבנית הספציפית","Mall namn: Information om specifik mall","Šablona 'name': Informace o specifické šablony","Имя' шаблон: Информация о конкретной шаблона","Name' Template: Impormasyon sa tukoy na template","Plantilya 'ngalan': Information sa piho nga template"
"Blocks: Blocks available","Blocks: Blocks available","Blokken: blokken beschikbaar","Bloques: Bloques disponibles","块：可用","Blöcke: Blöcke verfügbar","Taquets: disponibles","Blocchi: Blocchi disponibili","Blocos: Blocos disponíveis","Μπλοκ: διαθέσιμο μπλοκ","Bloki: Bloki dostępne","Blokke: Blokerer rådighed","Lohkot: lohkot saatavilla","Blokker: Blokker tilgjengelige","بنات: بنات المتاحة","블록 : 자료 블록","ブロック：使用可能なブロック","בלוקים: בלוקים זמינים","Block: Block tillgängliga","Bloky: Bloky k dispozici","Блоки Блоки доступные:","Blocks: available Blocks","Mga bloke: Bloke nga anaa"
"Block 'name': Informatin and data of the specified block","Block 'name': Informatin and data of the specified block","Block 'naam': Informatin en gegevens van de opgegeven blok","Bloquear 'nombre': Informatin y datos del bloque especificado","块“名称”：Informatin和指定块的数据","Block 'name': Informatin und Daten des angegebenen Block","Bloquer «nom»: Informatin et données du bloc spécifié","Block 'nome': informatin e di dati del blocco specificato","Bloco 'nome': Informatin e dados do bloco especificado","Αποκλεισμός «ονομασία»: Informatin και τα δεδομένα του συγκεκριμένου μπλοκ","Bloku 'name': Informatin danych określonego bloku","Blok 'navn': Informatin og data for den angivne blok","Block nimi: informatin ja tiedot määritetyn lohkon","Block 'navn': Informatin og data fra den angitte blokken","كتلة 'اسم': الإعلام المصري والبيانات من كتلة المحدد","블록 '이름'Informatin 지정된 블록의 데이터","ブロック「名前」：指定したブロックのInformatinとデータ","שם' הבלוק: Informatin ונתונים של גוש המסוים","Block 'name': Infor och data för det angivna blocket","Block 'name': Informatin a data ze zadaného bloku","Блока имя: Informatin и данных указанного блока","Name' Block: Informatin at data ng mga tinukoy na block","Block 'ngalan': Informatin ug data sa mga bungat block"
"Shows information about the templating system manual","Shows information about the templating system manual","Toont informatie over het templating systeem handleiding","Muestra información sobre el manual del sistema de plantillas","显示有关模板系统手册资料","Zeigt Informationen über den Template-System Handbuch","Affiche des informations sur le manuel du système de templates","Visualizzare le informazioni sul manuale del sistema di template","Mostra informações sobre o manual do sistema de templates","Εμφανίζει πληροφορίες σχετικά με το εγχειρίδιο συστήματος προτυποποίησης","Wyświetla informacje na temat instrukcji obsługi systemu szablonów","Viser oplysninger om templating systemet manualen","Näyttää tietoja sivupohjamoottori käyttöohjeesta","Viser informasjon om sjablonmiddel systemhåndboken","يعرض معلومات حول دليل نظام النموذجيه","템플릿 시스템 설명서에 대한 정보를 표시합니다","テンプレートシステムのマニュアルについての情報を表示します","ניתן לראות פרטים על המדריך לבניית תבנית המערכת","Visar information om mallsystemet manual","Zobrazuje informace o templating systémové příručce","Показывает информацию о системном руководстве шаблонов","Palabas sa impormasyon tungkol sa manual templating system","Nagpakita sa impormasyon mahitungod sa nagaplano sistema sa manwal"
"Info General information","Info General information","Info Algemene informatie","Información General Info","信息一般信息","Infos Allgemeine Informationen","Info Informations générales","Informazioni Informazioni generali","Informações Informações Gerais","Πληροφορίες Γενικές πληροφορίες","Informacje Informacje ogólne","Info Generel information","Info Yleistä","Info Generell informasjon","معلومات عامة معلومات","정보 일반 정보","情報一般情報","מידע מידע הכללי","Info Generell information","Informace Všeobecné informace","Информация Общая информация","Impormasyon Pangkalahatang impormasyon","Info General nga impormasyon"
"Copyright Copyright of the software","Copyright Copyright of the software","Auteursrecht Het auteursrecht op de software","Derechos de autor Copyright del software","版权所有的软件著作权","Urheberrecht Copyright der Software","Droit d'auteur Droit d'auteur du logiciel","Copyright Copyright del software","Direitos de Autor Copyright do software","Πνευματικά δικαιώματα Τα πνευματικά δικαιώματα του λογισμικού","Prawa autorskie Prawa autorskie do oprogramowania","Ophavsret Ophavsret af softwaren","Tekijänoikeudet Tekijänoikeudet ohjelmisto","Copyright Copyright av programvaren","حقوق الطبع والنشر حقوق الطبع والنشر من البرنامج","소프트웨어의 저작권 저작권","ソフトウェアの著作権に関する著作権","זכויות יוצרים זכויות היוצרים על התוכנה","Upphovsrätt Upphovsrätt av programvaran","Autorská práva Copyright softwaru","Авторские права на программное обеспечение","Copyright Copyright ng software","Copyright Copyright sa software"
"Version Current used version","Version Current used version","De huidige versie gebruikt versie","Versión utilizada versión actual","当前版本使用的版本","Version Aktuelle Version verwendet","Version actuelle version utilisée","Versione corrente versione utilizzata","Versão atual versão utilizada","Έκδοση ρεύματος που χρησιμοποιείται για την έκδοση","Wersja Aktualna wersja używana","Version Aktuel brugt udgave","Versio Nykyinen käytetty versio","Versjon Nåværende brukt versjon","الإصدار الحالي النسخة المستخدمة","버전 현재 사용 버전","バージョン現在使用されたバージョン","גרסה השתמשה בגרסה הנוכחית","Version Aktuell använt version","Aktuální verze používá verze","Текущая версия используемой версией","Bersyon Kasalukuyang ginagamit na bersyon","Version Current gigamit nga bersyon"
"Info Information on the model-view-controller options","Info Information on the model-view-controller options","Info Informatie over de model-view-controller opties","Información Información sobre las opciones de modelo-vista-controlador","信息模型 - 视图 - 控制器选项信息","Info Informationen zu den Model-View-Controller-Optionen","Infos Informations sur les options modèle-vue-contrôleur","Info Informazioni sulle opzioni Model-View-Controller","Informações As informações sobre as opções de MVC","Πληροφορίες Πληροφορίες σχετικά με τις επιλογές Model-View-Controller","Informacje Informacje na temat opcji Model-View-Controller","Info Oplysninger om model-view-controller muligheder","Info Tiedot MVC-arkkitehtuuri vaihtoehtoja","Info Opplysninger om Model-View-Controller alternativer","معلومات معلومات عن خيارات نموذج للرؤية وحدة تحكم","모델 - 뷰 - 컨트롤러 옵션에 대한 정보 정보","モデル・ビュー・コントローラ・オプションの詳細情報","מידע מידע על אפשרויות Model-View-בקר","Info Information om modell-view-controller alternativ","Info Informace o možnostech Model-View-Controller","Info Информация о вариантах модель-представление-контроллер","Impormasyon Impormasyon sa mga pagpipilian sa model-view-controller","Info Impormasyon sa model-panglantaw-controller mga kapilian"
"Info Manual for this manual","Info Manual for this manual","Info handleiding voor deze handleiding","Manual de información para este manual","信息手册本手册","Info Handbuch für dieses Handbuch","Infos Manuel pour ce manuel","Manuale Info per questo manuale","Manual de Informações para este manual","Πληροφορίες Εγχειρίδιο για αυτό το εγχειρίδιο","Instrukcja Informacje o tym podręczniku","Info Manual til denne vejledning","Info käsikirja tämä käsikirja","Info Manual for denne håndboken","معلومات دليل هذا الدليل","이 설명서에 대한 정보 설명서","このマニュアルの情報マニュアル","מדריך מידע למדריך זה","Info Manual för den här handboken","Info k obsluze tohoto návodu","Информация Руководство для этого руководства","Manual Impormasyon para sa manwal na ito","Info Manwal alang sa niini nga manwal"
"Shows the pay test page","Shows the pay test page","Toont de pay testpagina","Muestra la página de prueba de pago","显示薪酬测试页","Zeigt die Lohntestseite","Affiche la page de test de rémunération","Indica la pagina di test a pagamento","Mostra a página de teste de remuneração","Δείχνει το τεστ αμοιβή σελίδα","Pokazuje stronę testową wynagrodzenie","Viser løn testside","Näyttää palkka testisivu","Viser lønn testside","يظهر صفحة الاختبار الأجور","유료 테스트 페이지를 표시합니다","有料テストページを表示します","מציג את דף בדיקת השכר","Visar lön testsida","Zobrazí pay zkušební stránku","Показывает тестовую страницу оплаты","Ipinapakita ang mga test pay pahina","Nagpakita sa pay test panid"
"Shows the version of the software.","Shows the version of the software.","Geeft de versie van de software.","Muestra la versión del software.","示出了软件的版本。","Zeigt die Version der Software.","Affiche la version du logiciel.","Mostra la versione del software.","Mostra a versão do software.","Εμφανίζει την έκδοση του λογισμικού.","Pokazuje wersję oprogramowania.","Viser version af softwaren.","Näyttää ohjelmistoversio.","Viser versjonen av programvaren.","يدل على نسخة من البرنامج.","소프트웨어의 버전을 표시합니다.","ソフトウェアのバージョンを表示します。","מציג את הגרסה של התוכנה.","Visar version av programvaran.","Zobrazuje verzi softwaru.","Показывает версию программного обеспечения.","Ipinapakita ang mga bersyon ng software.","Nagpakita sa bersyon sa software."
