"key","en","nl","es","zh-CN","de","fr","it","pt","el","pl","da","fi","no","ar","ko","ja","iw","sv","cs","ru","tl","ceb"
"When another command is used that is not known. Shows the error page with redirect options.","When another command is used that is not known. Shows the error page with redirect options.","Wanneer een andere opdracht wordt gebruikt, dat niet bekend is. Toont de foutpagina met redirect opties.","Cuando se utiliza otro comando que no se conoce. Muestra la página de error con las opciones de redirección.","当另一个命令用于未知的。显示与重定向选项的错误页面。","Wenn ein anderer Befehl wird verwendet, das ist nicht bekannt. Zeigt die Fehlerseite mit Umleitungsoptionen.","Quand une autre commande est utilisée qui ne soit pas connu. Affiche la page d'erreur avec des options de redirection.","Quando si utilizza un altro comando che non è noto. Indica la pagina di errore con le opzioni di reindirizzamento.","Quando é utilizado um outro comando que não é conhecido. Mostra a página de erro com opções de redirecionamento.","Όταν χρησιμοποιείται μια άλλη εντολή που δεν είναι γνωστή. Δείχνει τη σελίδα λάθους με επιλογές ανακατεύθυνσης.","Kiedy używany jest inne polecenie, że nie jest znany. Przedstawia stronę błędu z opcji przekierowania.","Når en anden kommando bruges som ikke er kendt. Viser fejlside med Redirect muligheder.","Kun toinen komentoa käytetään, että ei ole tiedossa. Näyttää virhe sivu uudelleenohjaus vaihtoehtoja.","Når en annen kommando brukes som ikke er kjent. Viser feilside med viderekobling alternativer.","عند استخدام أمر آخر غير معروف. يظهر صفحة الخطأ مع خيارات إعادة التوجيه.","다른 명령이 사용될 때 알려지지 않은 것이다. 리디렉션 옵션을 사용하여 오류 페이지를 표시합니다.","別のコマンドが使用されるときは知られていないこと。リダイレクトオプションを使用してエラーページを表示します。","כאשר פקודה אחרת משמשת שאינו ידוע. מציג את דף השגיאה עם אפשרויות הפניה.","När en annan kommando används som inte är känd. Visar felsida med omdirigera alternativ.","Je-li použit jiný příkaz, který není znám. Zobrazí chybová stránka s možností přesměrovat.","При использовании другая команда, не известно. Показывает страницу ошибки с параметрами перенаправления.","Kapag isa pang command ay ginagamit na ito ay hindi kilala. Ipinapakita ang mga pahina ng error na may mga pagpipilian sa pag-redirect.","Sa diha nga laing sugo gigamit nga wala makaila. Nagpakita sa sayop nga pahina uban sa redirect kapilian."
"displays the cms page like this cms identifier value for example: speed, price, scalability, features and security.","displays the cms page like this cms identifier value for example: speed, price, scalability, features and security.","geeft de pagina cms als dit cms identifier waarde bijvoorbeeld: snelheid, prijs, schaalbaarheid, functies en beveiliging.","muestra la página cms como este valor cms identificador por ejemplo: velocidad, el precio, la escalabilidad, las características y la seguridad.","显示这样的CMS标识值例如CMS页：速度，价格，可扩展性，功能和安全性。","zeigt die CMS-Seite wie diese cms Kennungswert zB: Geschwindigkeit, Preis, Skalierbarkeit, Funktionen und Sicherheit.","affiche la page CMS comme cette valeur de CMS identifiant par exemple: vitesse, évolutivité, prix, caractéristiques et de la sécurité.","visualizza la pagina CMS come questo valore cms identificativo per esempio: velocità, prezzo, scalabilità, funzionalità e sicurezza.","exibe a página cms como este valor identificador cms por exemplo: velocidade, preço, escalabilidade funcionalidades e segurança.","εμφανίζει τη σελίδα CMS όπως αυτή CMS τιμή αναγνωριστικού για παράδειγμα: ταχύτητα, η τιμή, επεκτασιμότητα, τα χαρακτηριστικά και την ασφάλεια.","wyświetla stronę cms cms wartości podobny do tego na przykład: identyfikator prędkości, ceny, skalowalność, możliwości i bezpieczeństwa.","viser cms side som denne cms id værdi for eksempel: hastighed, pris, skalerbarhed, funktioner og sikkerhed.","näyttää CMS sivu näin CMS tunnisteen arvo esimerkiksi: nopeus, hinta, skaalautuvuutta, ominaisuuksia ja turvallisuutta.","viser cms side som dette cms identifikator verdi for eksempel: hastighet, pris, skalerbarhet, funksjoner og sikkerhet.","يعرض صفحة سم مثل هذه قيمة سم معرف على سبيل المثال: سرعة، سعر، والتدرجية، وميزات والأمن.","속도, 가격, 확장 성, 기능 및 보안 :이 예를 들어 CMS 식별자 값과 같은 CMS 페이지를 표시합니다.","スピード、価格、拡張性、機能とセキュリティ：この例のCMS識別子の値のようなCMSのページが表示されます。","מציג את דף CMS כמו ערך זה CMS מזהה לדוגמא: מהירות, מחיר, יכולת הרחבה, תכונות וביטחון.","visar cms sida som denna cms identifierare värde till exempel: hastighet, pris, skalbarhet, funktioner och säkerhet.","zobrazí stránku CMS, jako je tento CMS hodnotu identifikátoru například: rychlost, cena, škálovatelnost, funkce a bezpečnost.","отображает страницу CMS как это значение СЦИ идентификатором, например: скорость, цена, масштабируемость, особенности и безопасности.","nagpapakita ng mga pahina ng CMS tulad nito CMS halaga identifier halimbawa: bilis, presyo, kakayahang sumukat, mga tampok at seguridad.","nagpasundayag sa CMS panid nga sama niini sa CMS ilhanan bili alang sa panig-ingnan: speed, bili, scalability, bahin ug seguridad."
"Displays the products tagged with specific ‘tag’. From the given example below,This provides the products tagged with ‘cute’. Example: http://linux:8000/base/Tag/cute","Displays the products tagged with specific ‘tag’. From the given example below,This provides the products tagged with ‘cute’. Example: http://linux:8000/base/Tag/cute","Geeft de producten gelabeld met specifieke 'tag'. Uit het gegeven voorbeeld hieronder, Dit levert de producten met het label 'schattig'. Bijvoorbeeld: http: // linux: 8000 / base / Tag / schattige","Muestra los productos etiquetados con 'tag' específico. A partir del ejemplo que figura a continuación, Esto proporciona los productos etiquetados con 'lindo'. Ejemplo: http: // linux: 8000 / base / Tag / lindo","显示标记特定的“标签”的产品。从下面给定的例子中，这提供了具有标记“可爱”的产品。例如：http：// Linux系统：8000 /基/标签/可爱","Zeigt die Produkte mit spezifischen 'tag' markiert. Aus dem gegebenen Beispiel unten, Dies bietet die Produkte mit 'cute' markiert. Beispiel: http: // linux: 8000 / base / Tag / niedlichen","Affiche les produits taggés avec 'tag' spécifique. De l'exemple donné ci-dessous, cela fournit les produits taggés avec 'cute'. Exemple: http: // linux: 8000 / base / Tag / mignon","Visualizza i prodotti taggati con 'tag' specifico. Dall'esempio indicato di seguito, questo modo i prodotti taggati con 'carino'. Esempio: http: // linux: 8000 / base / Tag / carino","Exibe os produtos marcados com 'tag' específico. A partir do exemplo dado abaixo, Isso fornece os produtos marcados com 'bonito'. Exemplo: http: // linux: 8000 / base / Tag / bonito","Εμφανίζει τα προϊόντα με ετικέτα με συγκεκριμένες «ετικέτα». Από το παράδειγμα που δίνεται παρακάτω, Αυτό παρέχει τα προϊόντα με ετικέτα «χαριτωμένο». Παράδειγμα: http: // linux: 8000 / βάσης / Tag / χαριτωμένο","Wyświetla produkty oznaczone tagiem ze szczególnym ''. W podanym przykładzie poniżej, to zapewnia Produkty oznaczone tagiem 'słodki'. Przykład: http: // linux: 8000 / base / Tag / słodkie","Viser produkter tagget med specifikke 'tag'. Fra det givne eksempel nedenfor, Dette giver produkterne tagget med 'søde'. Eksempel: http: // linux: 8000 / base / Tag / sød","Näyttää Tuotteita sanalle erityistä tag. Annetuista Alla olevassa esimerkissä Tämä tarjoaa Tuotteita sanalle söpö. Esimerkki: http: // linux: 8000 / base / Tag / söpö","Viser produkter merket med spesifikk 'tag'. Fra den gitte eksemplet nedenfor gir Dette produkter merket med søt. Eksempel: http: // linux: 8000 / base / Tag / søt","يعرض المنتجات الموسومة ب 'علامة' محددة. من المثال المذكور أدناه، وهذا يوفر المنتجات الموسومة ب لطيف. على سبيل المثال: HTTP: // لينكس: 8000 / القاعدة / العلامة / لطيف","특정 '태그'태그 제품을 표시합니다. 아래 주어진 예에서,이 '귀여운'태그 제품을 제공합니다. 예 : HTTP : // 리눅스 : 8000 /베이스 / 태그 / 귀여운","具体的な「タグ」でタグ付けされた製品を表示します。下記の例から、これは「かわいい」でタグ付けされた製品を提供しています。例：のhttp：//のlinux：8000 /ベース/タグ/かわいいです","מציג את המוצרים מתויגים עם 'תג' ספציפי. מהדוגמא שניתנה בהמשך, זה מספק מוצרים מתויגים עם 'חמוד'. לדוגמא: http: // לינוקס: 8000 / בסיס / תג / חמוד","Visar de produkter märkta med särskilda tagg. Från det givna exemplet nedan, ger detta produkter märkta med gulligt. Exempel: http: // linux: 8000 / bas / Tag / söt","Zobrazuje produkty označené konkrétní značku. Z uvedeného příkladu níže, To poskytuje produkty označené značkou roztomilý. Příklad: http: // linux: 8000 / base / den / roztomilý","Отображает продукты, помеченные определенной метки. Из данного примера ниже, это обеспечивает продукции с тегом мило. Пример: HTTP: // Linux: 8000 / база / Метки / мило","Ipinapakita ang mga produkto na-tag na may mga tiyak na 'tag'. Mula sa ibinigay na halimbawa sa ibaba, ito ay nagbibigay ng mga produkto na-tag ng 'cute'. Halimbawa: http: // linux: 8000 / base / Tag / cute","Nagpasundayag sa mga produkto nga tagged uban sa piho nga 'tag'. Gikan sa gihatag nga panig-ingnan sa ubos, kini naghatag og sa mga produkto nga tagged sa 'cute'. Panig-ingnan: http: // Linux: 8000 / base / Tag / cute"
"Displays the product items placed in the cart, including its calculation of the total price.","Displays the product items placed in the cart, including its calculation of the total price.","Geeft het product items geplaatst in de wagen, met inbegrip van de berekening van de totale prijs.","Muestra los elementos de productos colocados en el carro, incluyendo su cálculo del precio total.","显示放置在车中的产品项目，包括它的计算总价。","Zeigt die Produkt Artikel in den Einkaufswagen gelegt, einschließlich der Berechnung des Gesamtpreises.","Affiche les éléments de produits placés dans le panier, y compris le calcul du prix total.","Consente di visualizzare le voci di prodotto inseriti nel carrello, tra cui il calcolo del prezzo totale.","Exibe os itens de produtos colocados no carrinho, incluindo o cálculo do preço total.","Εμφανίζει τα στοιχεία προϊόντος που διατίθεται στο καλάθι, συμπεριλαμβανομένου του υπολογισμού της συνολικής τιμής.","Wyświetla pozycje produktów umieszczonych w koszyku, w tym jego obliczenia całkowitej ceny.","Viser de produktgrupper genstande, der placeres i vognen, herunder beregningen af ​​den samlede pris.","Näyttää tuotteen eriä sijoitettu korissa, mukaan lukien sen laskeminen kokonaishinnasta.","Viser produkt ting i handlekurven, herunder beregning av den totale prisen.","يعرض أصناف المنتجات وضعها في عربة، بما في ذلك حسابها من السعر الاجمالي.","총 가격의 계산을 포함 카트에 위치 제품 항목을 표시합니다.","合計金額のその計算を含むカートに​​置かれ、製品の項目を表示します。","מציג את פריטי המוצר ממוקמים בעגלה, כולל החישוב של המחיר הכולל.","Visar produkt föremål som placeras i vagnen, inklusive sin beräkning av det totala priset.","Zobrazí položky výrobku umístěného v nákupním košíku, včetně jejího výpočtu celkové ceny.","Отображение пунктов продукт помещен в корзину, в том числе его расчета общей стоимости.","Ipinapakita ang mga bagay na produkto na inilagay sa mga cart, kabilang ang kanyang pagkalkula ng kabuuang presyo.","Nagpasundayag sa mga produkto nga mga butang nga gibutang sa carromata, lakip na sa iyang kalkulasyon sa kinatibuk-ang bili."
"Adter the data command is executed, to show the user what happened..","Adter the data command is executed, to show the user what happened..","Adter de data opdracht wordt uitgevoerd, om de gebruiker gebeurtenissen tonen ..","Adter se ejecuta el comando de datos, para mostrar al usuario lo que pasó ..","Adter执行数据的命令，以显示发生了什么用户..","Adter die Daten Befehl ausgeführt wird, um den Benutzer zu zeigen, was passiert ist ..","Adter la commande de données est exécutée, montrer à l'utilisateur ce qui est arrivé ..","Adter viene eseguito il comando di dati, per mostrare all'utente quello che è successo ..","Adter o comando de dados é executado, para mostrar ao usuário o que aconteceu ..","Adter η εντολή εκτελείται δεδομένα, για να δείξει το χρήστη τι συνέβη ..","Adter dane polecenie zostanie wykonane, aby pokazać użytkownikowi, co się stało ..","Adter kommandoen data er udført, for at vise brugeren, hvad der skete ..","Adter tiedot komento suoritetaan, osoittaa käyttäjälle, mitä tapahtui ..","Adter data kommandoen utføres, for å vise brukeren hva som skjedde ..","Adter يتم تنفيذ الأمر البيانات، لتظهر للمستخدم ما حدث ..","있었는지 사용자에게 표시하기 위해, 데이터 명령이 실행 Adter ..","何が起こったのかをユーザに示すために、データコマンドが実行されAdter ..","Adter פקודת הנתונים מבוצעת, כדי להראות למשתמש את מה שקרה ..","Adter kommandot uppgifterna utförs, för att visa användaren vad som hände ..","Adter příkaz dat je proveden, ukázat uživateli, co se stalo ..","Adter команда данных производится, чтобы показать пользователю, что произошло ..","Adter ang command data ay pinaandar, upang ipakita ang mga user kung ano ang nangyari ..","Adter ang data sugo gipatay, aron sa pagpakita sa mga user unsay nahitabo .."
"Displays a test page, used for testing certainfunctionalities while developing or creating your design.","Displays a test page, used for testing certainfunctionalities while developing or creating your design.","Geeft een testpagina, wordt gebruikt voor het testen van certainfunctionalities terwijl de ontwikkeling of het creëren van uw ontwerp.","Muestra una página de prueba, que se utiliza para probar certainfunctionalities mientras que el desarrollo o la creación de su diseño.","显示一个测试页面，用于测试certainfunctionalities在开发或创建你的设计。","Zeigt eine Testseite, zum Testen certainfunctionalities während die Entwicklung oder die Erstellung Ihrer Design verwendet.","Affiche une page de test, utilisé pour tester certainfunctionalities tout en développant ou en créant votre conception.","Consente di visualizzare una pagina di prova, utilizzati per testare certainfunctionalities durante lo sviluppo o la creazione di vostro disegno.","Exibe uma página de teste, usado para testar certainfunctionalities durante o desenvolvimento ou a criação de seu projeto.","Εμφανίζει μια δοκιμαστική σελίδα, χρησιμοποιείται για τη δοκιμή certainfunctionalities παράλληλα με την ανάπτυξη ή τη δημιουργία του σχεδιασμού σας.","Wyświetla stronę testową, używane do testowania certainfunctionalities przy opracowywaniu lub tworząc swój projekt.","Viser en testside, der anvendes til at teste certainfunctionalities samtidig udvikle eller oprette dit design.","Näyttää testisivun, jota käytetään testaamaan certainfunctionalities samalla kehittää tai luoda oman suunnittelun.","Viser en testside, som brukes for å teste certainfunctionalities samtidig utvikle eller lage din design.","يعرض صفحة اختبار، وتستخدم لاختبار certainfunctionalities مع تطوير أو إنشاء التصميم الخاص بك.","개발하는 동안 certainfunctionalities을 테스트하거나 디자인을 만드는 데 사용되는 테스트 페이지를 표시합니다.","開発中certainfunctionalitiesをテストしたり、デザインを作成するために使用されるテストページを表示します。","מציג דף בדיקה, המשמש לבדיקת certainfunctionalities תוך פיתוח או יצירת העיצוב שלך.","Visar en testsida, som används för att testa certainfunctionalities samtidigt utveckla eller skapar din design.","Zobrazí zkušební stránku, který se používá pro testování certainfunctionalities při vývoji nebo vytváření designu.","Отображает тестовую страницу, используемую для тестирования certainfunctionalities при разработке или создании дизайна.","Nagpapakita ng isang pahina sa pagsubok, na ginagamit para sa pagsubok certainfunctionalities habang pagbuo o paglikha ng iyong disenyo.","Nagpasundayag sa usa ka pagsulay nga pahina, nga gigamit alang sa pagsulay certainfunctionalities samtang pagpalambo sa o sa paghimo sa imong mga plano."
"Displays a text 'page Not available, You have no right to access this page'.","Displays a text 'page Not available, You have no right to access this page'.","Geeft een tekst 'pagina niet beschikbaar, je hebt geen recht om toegang te krijgen tot deze pagina'.","Muestra un texto 'página no está disponible, no tiene derecho a acceder a esta página .","显示文本页面不可用，你有没有访问此页面右侧“。","Zeigt einen Text Seite nicht verfügbar, Sie haben kein Recht, diese Seite zu betreten.","Affiche un texte page pas disponible, vous avez pas le droit d'accéder à cette page.","Consente di visualizzare un testo 'pagina di Non disponibile, Non avete il diritto di accedere a questa pagina'.","Exibe um texto página não disponível, você não tem direito de acessar esta página.","Εμφανίζει ένα κείμενο «σελίδα Δεν υπάρχουν διαθέσιμα στοιχεία, δεν έχετε δικαίωμα πρόσβασης σε αυτή τη σελίδα».","Wyświetla tekst strona niedostępna, Nie masz prawa dostępu do tej strony.","Viser en tekst 'side Ikke tilgængelig, Du har ingen ret til at få adgang til denne side.","Näyttää teksti sivu Ei käytettävissä, Sinulla ei ole oikeutta käyttää tätä sivua.","Viser en tekst side Ikke tilgjengelig, har du ingen rett til å få tilgang til denne siden. '","يعرض النص الصفحة غير متوفرة، لا يوجد لديك حق الوصول إلى هذه الصفحة.","텍스트 표시 '페이지 없음, 당신은이 페이지에 액세스 할 권리가 없다'.","テキスト表示」ページは利用できません、あなたはこのページにアクセスする権利はありません」。","הצגת טקסט 'דף לא זמין, אין לך זכות לגשת לדף זה .","Visar en text sidan Ej tillgänglig, du har ingen rätt att få tillgång till den här sidan .","Zobrazuje text stránku není k dispozici, nemáte právo na přístup na tuto stránku.","Отображает текст страница не доступна, не имеют права доступа к этой странице».","Nagpapakita ng isang text 'Hindi magagamit page, Wala kang karapatan upang ma-access ang pahinang ito'.","Nagpasundayag sa usa ka teksto 'pahina Dili anaa, kamo walay katungod sa pag-access niini nga panid."
"Displays a text 'page not found ,The page that you are looking for (no longer) exists.'","Displays a text 'page not found ,The page that you are looking for (no longer) exists.'","Geeft een tekst 'pagina niet gevonden De pagina die u zoekt niet (meer) bestaat.'","Muestra un texto página no encontrada, La página que estás buscando (ya) no existe.","显示一个文本“找不到网页，你正在寻找（不再）存在的页面。”","Zeigt einen Text Seite nicht gefunden Die Seite, die Sie nicht (mehr) existiert auf der Suche.","Affiche un texte page non trouvée, la page que vous cherchez (plus) existe.","Consente di visualizzare un testo 'pagina non trovata, la pagina che state cercando (non più) esiste.'","Exibe um texto 'página não encontrada, A página que você está procurando (não) existe.'","Εμφανίζει ένα κείμενο η σελίδα δεν βρέθηκε, η σελίδα που ψάχνετε (πλέον) υπάρχει.»","Wyświetla tekst Nie znaleziono strony, Strona, której szukasz, (nie) istnieje.","Viser en tekst 'side ikke fundet, Den side, du søger efter (ikke længere) findes. «","Näyttää teksti sivua ei löydy, sivu, joka olet etsimässä (ei enää) olemassa.","Viser en tekst side ikke funnet, Siden du leter etter (ikke lenger) eksisterer. '","يعرض النص الصفحة لم يتم العثور على الصفحة التي كنت تبحث عن (لم يعد) موجود.","텍스트 표시 '페이지를 찾을 수 없습니다, 당신은 존재 (더 이상) 찾고있는 페이지를.'","テキスト表示「ページが見つかりません、あなたが存在する（もはや）探しているページを。」","הצגת טקסט 'דף לא נמצא, הדף שאתה מחפש (כבר לא) קיים. ","Visar en text sidan hittades inte, den sida som du letar efter (inte längre) finns. ","Zobrazí text Stránka nebyla nalezena, stránka, kterou hledáte (již) neexistuje.","Отображает текст страница не найдена, страницы, которые вы ищете (больше нет) существует.","Nagpapakita ng isang text 'Hindi natagpuan ang pahina, ang pahina na iyong hinahanap para sa (hindi na) umiiral na.'","Nagpasundayag sa usa ka teksto 'pahina dili makita, ang panid nga imong gipangita (dili na) anaa.'"
"Displays a text “page not found ,The page that you are looking for (no longer) exists.","Displays a text “page not found ,The page that you are looking for (no longer) exists.","Geeft een pagina tekst niet gevonden, de pagina die u zoekt niet (meer) bestaat.","Muestra una página de texto no encontrado, La página que estás buscando (ya) no existe.","显示一个文本“找不到网页，您正在查找的页（不再）存在。","Zeigt einen Text Seite nicht gefunden, wird die Seite, die Sie suchen, nicht (mehr) vorhanden ist.","Affiche une page de texte pas trouvé, la page que vous cherchez (plus) existe.","Consente di visualizzare una pagina di testo non trovato, la pagina che state cercando (non più) esiste.","Exibe uma página de texto não encontrado, a página que você está procurando (não) existe.","Εμφανίζει μια σελίδα κειμένου δεν βρέθηκε, η σελίδα που ψάχνετε (πλέον) υπάρχει.","Wyświetla stronę tekstu nie znaleziono, Strona, której szukasz, (nie) istnieje.","Viser en tekst side ikke fundet, Den side, du søger efter (ikke længere) eksisterer.","Näyttää teksti sivua ei löydy, sivu, joka olet etsimässä (ei enää) olemassa.","Viser en tekst side ikke funnet, Siden du leter etter (ikke lenger) eksisterer.","يعرض صفحة النص لم يتم العثور على الصفحة التي كنت تبحث عن (لم يعد) موجود.","텍스트 페이지가, 당신이 찾고있는 페이지를 찾을 수 없습니다 디스플레이 (더 이상) 존재하지 않습니다.","テキスト」ページでは、あなたが探しているページが見つかりません表示されます（もはや）存在しません。","מציג דף טקסט לא מצא, בעמוד שאתם מחפשים (כבר לא) קיימים.","Visar en text sida inte hittas, Sidan som du letar efter (inte längre) finns.","Zobrazí stránky text nebyl nalezen, stránku, kterou hledáte (již) neexistuje.","Не отображает страницу текста не найден, страницы, которые вы ищете (больше нет) существует.","Nagpapakita hindi natagpuan ang isang pahina ng teksto , Ang pahina na iyong hinahanap para sa (hindi na) umiiral na.","Nagpasundayag sa usa ka text pahina dili makita, ang panid nga imong gipangita (dili na) anaa."
